{"id":"CLM-GEI-GEN1-001","type":"claim","title":"Genesis 1 contains an ordered sequence compatible with hydraulic analogy","status":"active","version":"1.0.9","claim":"The sequence and vocabulary of Genesis 1 can be compared with ordered water-management functions without asserting that the text historically describes a dam system.","question_ids":["QST-GEI-GEN1-001"],"source_ids":["SRC-GEN-001"],"evidence_ids":["EVD-WTR-GEI-001"],"comparison_ids":["CMP-GEN-EGY-001","CMP-GEN-MES-001"],"interpretation_ids":["INT-GEI-001"],"counterevidence_ids":[],"confidence":"C1","notes":"Provisional research proposition. Historical intent and causal transmission remain unestablished."}